{
  "version": "smerc.spark-evidence.v1",
  "evidence_id": "spark-mcp-001",
  "collected_at": "2026-08-15T00:05:00Z",
  "source_systems": ["mcp_proxy", "agent_runner", "policy"],
  "action_metadata": {
    "action_id": "agent-export-customer-records",
    "description": "Agent proposes exporting customer records to an external support tool.",
    "actor": "support_agent",
    "tool": "mcp.customer_export",
    "operation": "export_customer_records",
    "resource": "customer-records",
    "environment": "production",
    "authority_basis": "tool scope is present but destination evidence is incomplete",
    "authority_confidence": 0.46,
    "external_side_effect": true,
    "sensitive_data": true
  },
  "recoverability_signals": {
    "base_action_risk": 0.82,
    "reversibility": 0.22,
    "containment_strength": 0.34,
    "rollback_latency": 0.78,
    "evidence_validity": 0.41,
    "anomaly_pressure": 0.62,
    "impact_scope": 0.73,
    "cancel_reliability": 0.28,
    "rollback_method": "external export cannot be reliably recalled after transfer"
  },
  "evidence_gaps": [
    "destination data-handling proof missing",
    "record count not bounded",
    "reviewer approval not attached"
  ],
  "non_secret_boundary": true
}
